{
  "schema_version": 2,
  "id": "frontend-performance",
  "name": "小林（首页性能排查）",
  "source": "temporary",
  "status": "active",
  "capabilities": ["bundle-analysis", "react-performance", "runtime-profiling"],
  "scope": ["homepage-startup", "read-only-analysis"],
  "responsibility": "Profile homepage startup while the investigation remains exploratory.",
  "inputs": ["homepage trace", "bundle statistics", "current source"],
  "outputs": ["profile evidence", "ranked bottlenecks", "Handoff"],
  "preferred_model": null,
  "instructions": { "required": ["practice:investigation", "contract:handoff", "policy:safety-boundary"], "optional": [] },
  "tools": ["browser-trace", "bundle-inspector"],
  "context": {
    "read_paths": ["src/", "dist/stats.json"],
    "write_paths": [".xiaotao/memory/temporary/active/performance-example/workers/frontend-performance/"]
  },
  "permissions": {
    "autonomous": ["inspect-project", "run-nondestructive-checks", "write-work-artifacts"],
    "conditional": []
  },
  "lifecycle": {
    "scope": "temporary",
    "temporary_id": "performance-example",
    "expires_at": "temporary-archive"
  }
}
